videoId,channelId,channelTitle,publishTime,title,description,thumbnail_default,thumbnail_medium,thumbnail_high,liveBroadcastContent
Tr4LFcO7fVQ,UCKIEPfI9D32EnsP6oasduSg,Alljit สุขภาพจิตใจ,2021-10-24T15:15:03Z,วิธีการ Move On จากนักจิตวิทยา ให้เราอยู่กับปัจจุบัน มากยิ่งขึ้น  พร้อมก้าวต่อไป - ฟังก่อนนอน EP.13,Alljit ร่วมกับคุณวันเฉลิม คงคาหลวง (นักจิตวิทยาการปรึกษา) เจ้าของแฟนเพจ Trust.นักจิตวิทยาการปรึกษา วิธีการ Move On จากนักจิตวิทยา ...,https://i.ytimg.com/vi/Tr4LFcO7fVQ/default.jpg,https://i.ytimg.com/vi/Tr4LFcO7fVQ/mqdefault.jpg,https://i.ytimg.com/vi/Tr4LFcO7fVQ/hqdefault.jpg,none
tpVHF_QGCN8,UCKIEPfI9D32EnsP6oasduSg,Alljit สุขภาพจิตใจ,2021-10-24T13:00:14Z,การบอกเลิกให้เจ็บน้อยที่สุด ด้วยจิตวิทยาความรัก เมื่อต้องยุติความสัมพันธ์,การบอกเลิกให้เจ็บน้อยที่สุด ด้วย #จิตวิทยาความรัก เมื่อต้องยุติความสัมพันธ์ 00:00 l เริ่ม 00:30 l หมดรักกันแล้วแต่ต้องอยู่เพราะผูกพันธ์ 01:10 l ...,https://i.ytimg.com/vi/tpVHF_QGCN8/default.jpg,https://i.ytimg.com/vi/tpVHF_QGCN8/mqdefault.jpg,https://i.ytimg.com/vi/tpVHF_QGCN8/hqdefault.jpg,none
tf5K5n9VwAY,UCKIEPfI9D32EnsP6oasduSg,Alljit สุขภาพจิตใจ,2021-10-23T14:00:11Z,ความรู้สึกว่างเปล่า ไม่รู้ว่ามีชีวิตไปเพื่ออะไรในแต่ละวัน  - ฟังก่อนนอน EP.12,Alljit ร่วมกับคุณวันเฉลิม คงคาหลวง (นักจิตวิทยาการปรึกษา) เจ้าของแฟนเพจ Trust.นักจิตวิทยาการปรึกษา ๒ความรู้สึกว่างเปล่า ...,https://i.ytimg.com/vi/tf5K5n9VwAY/default.jpg,https://i.ytimg.com/vi/tf5K5n9VwAY/mqdefault.jpg,https://i.ytimg.com/vi/tf5K5n9VwAY/hqdefault.jpg,none
Ug6iBICPITA,UCKIEPfI9D32EnsP6oasduSg,Alljit สุขภาพจิตใจ,2021-10-22T14:00:12Z,อยากรักตัวเองให้เก่งๆ อยากห่วงตัวเองให้มากๆ ด้วยจิตวิทยาการรักตัวเอง,อยากรักตัวเองให้เก่งๆ อยากห่วงตัวเองให้มากๆ ด้วย #จิตวิทยาการรักตัวเอง 00:00 l เริ่ม 00:40 l ทำไมเราถึงปลอบใจตัวเองไม่เก่ง 05:00 l ...,https://i.ytimg.com/vi/Ug6iBICPITA/default.jpg,https://i.ytimg.com/vi/Ug6iBICPITA/mqdefault.jpg,https://i.ytimg.com/vi/Ug6iBICPITA/hqdefault.jpg,none
iX4Oi9DfrNo,UCKIEPfI9D32EnsP6oasduSg,Alljit สุขภาพจิตใจ,2021-10-22T10:34:45Z,การปล่อยวาง ตามหลักจิตวิทยา,การปล่อยวาง ตามหลักจิตวิทยา รวมบทความสุขภาพใจใน - https://www.alljitblog.com/ ฟัง Alljit Podcast ในช่องทางอื่นๆ Spotify ...,https://i.ytimg.com/vi/iX4Oi9DfrNo/default.jpg,https://i.ytimg.com/vi/iX4Oi9DfrNo/mqdefault.jpg,https://i.ytimg.com/vi/iX4Oi9DfrNo/hqdefault.jpg,none
FgfgzoJ22ZI,UCKIEPfI9D32EnsP6oasduSg,Alljit สุขภาพจิตใจ,2021-10-21T14:30:10Z,การคิดบวก แม้ในวันที่โลกเหวี่ยงเรื่องแย่ๆ เข้ามา ก็ยังเห็นมุมมองดีๆ - ฟังก่อนนอน EP.11,Alljit ร่วมกับคุณวันเฉลิม คงคาหลวง (นักจิตวิทยาการปรึกษา) เจ้าของแฟนเพจ Trust.นักจิตวิทยาการปรึกษา การคิดบวก ...,https://i.ytimg.com/vi/FgfgzoJ22ZI/default.jpg,https://i.ytimg.com/vi/FgfgzoJ22ZI/mqdefault.jpg,https://i.ytimg.com/vi/FgfgzoJ22ZI/hqdefault.jpg,none
7kcz6q83bck,UCKIEPfI9D32EnsP6oasduSg,Alljit สุขภาพจิตใจ,2021-10-20T13:45:11Z,ทำไมถึงชอบคิดลบ ชอบมองโลกในแง่ลบ และเราจะอยู่กับมันอย่างไร?,ทำไมถึงชอบคิดลบ ชอบมองโลกในแง่ลบ และเราจะอยู่กับมันอย่างไร? 00:00 l เริ่ม 00:35 l ความดินด้านลบในตัวเราเกิดขึ้นได้อย่างไร ? 06:00 l ...,https://i.ytimg.com/vi/7kcz6q83bck/default.jpg,https://i.ytimg.com/vi/7kcz6q83bck/mqdefault.jpg,https://i.ytimg.com/vi/7kcz6q83bck/hqdefault.jpg,none
4KD_FOkLLwg,UCKIEPfI9D32EnsP6oasduSg,Alljit สุขภาพจิตใจ,2021-10-19T19:23:25Z,เมื่อต้องเลิกกันทั้งๆ ที่ยังรัก,ฟัง Alljit Podcast ในช่องทางอื่นๆ Spotify - https://open.spotify.com/show/6cI6XXv5JzS8iTRgA7KDc2 Apple Podcast ...,https://i.ytimg.com/vi/4KD_FOkLLwg/default.jpg,https://i.ytimg.com/vi/4KD_FOkLLwg/mqdefault.jpg,https://i.ytimg.com/vi/4KD_FOkLLwg/hqdefault.jpg,none
tfSrZ2fqqvY,UCKIEPfI9D32EnsP6oasduSg,Alljit สุขภาพจิตใจ,2021-10-19T13:45:13Z,รู้สึกเหนื่อยกับความรัก เหนื่อยกับชีวิตคู่ แต่ยังอยากไปต่อ ทำอย่างไรดี,รู้สึกเหนื่อยกับความรัก เหนื่อยกับชีวิตคู่ แต่ยังอยากไปต่อ ทำอย่างไรดี 00:00 l เริ่ม 00:30 l เคยเหนื่อยกับความรักบ้างไหม ? 02:00 l ...,https://i.ytimg.com/vi/tfSrZ2fqqvY/default.jpg,https://i.ytimg.com/vi/tfSrZ2fqqvY/mqdefault.jpg,https://i.ytimg.com/vi/tfSrZ2fqqvY/hqdefault.jpg,none
fXt-0eEuvBU,UCKIEPfI9D32EnsP6oasduSg,Alljit สุขภาพจิตใจ,2021-10-18T14:30:24Z,จิตวิทยาการร้องไห้ เมื่อน้ำตา.. อาจเป็นมากกว่าที่เราคิด - ฟังก่อนนอน EP.10,Alljit ร่วมกับคุณวันเฉลิม คงคาหลวง (นักจิตวิทยาการปรึกษา) เจ้าของแฟนเพจ Trust.นักจิตวิทยาการปรึกษา จิตวิทยาการร้องไห้ ...,https://i.ytimg.com/vi/fXt-0eEuvBU/default.jpg,https://i.ytimg.com/vi/fXt-0eEuvBU/mqdefault.jpg,https://i.ytimg.com/vi/fXt-0eEuvBU/hqdefault.jpg,none
ocNbRf75uKw,UCKIEPfI9D32EnsP6oasduSg,Alljit สุขภาพจิตใจ,2021-10-17T14:45:26Z,อย่ารู้สึกผิด หากรู้สึกว่าตัวเองอ่อนแอ ควรให้เวลาตัวเองอ่อนแอบ้าง - ฟังก่อนนอน EP.9,Alljit ร่วมกับคุณวันเฉลิม คงคาหลวง (นักจิตวิทยาการปรึกษา) เจ้าของแฟนเพจ Trust.นักจิตวิทยาการปรึกษา อย่ารู้สึกผิด หากรู้สึกว่าตัวเองอ่อนแอ ...,https://i.ytimg.com/vi/ocNbRf75uKw/default.jpg,https://i.ytimg.com/vi/ocNbRf75uKw/mqdefault.jpg,https://i.ytimg.com/vi/ocNbRf75uKw/hqdefault.jpg,none
OJqFlcZdpCc,UCKIEPfI9D32EnsP6oasduSg,Alljit สุขภาพจิตใจ,2021-10-16T14:30:10Z,การให้อภัยตัวเองจากอดีตที่เคยทำผิดพลาด เราเป็นมนุษย์คนนึง เราผิดพลาดได้ - ฟังก่อนนอน EP.8,Alljit ร่วมกับคุณวันเฉลิม คงคาหลวง (นักจิตวิทยาการปรึกษา) เจ้าของแฟนเพจ Trust.นักจิตวิทยาการปรึกษา ...,https://i.ytimg.com/vi/OJqFlcZdpCc/default.jpg,https://i.ytimg.com/vi/OJqFlcZdpCc/mqdefault.jpg,https://i.ytimg.com/vi/OJqFlcZdpCc/hqdefault.jpg,none
OFZp_IsIBxw,UCKIEPfI9D32EnsP6oasduSg,Alljit สุขภาพจิตใจ,2021-10-14T18:48:14Z,ความสุขของคุณหาได้จากไหน ?,ความสุข ของคุณหาได้จากไหน ? รวมบทความสุขภาพใจใน - https://www.alljitblog.com/ ฟัง Alljit Podcast ในช่องทางอื่นๆ Spotify ...,https://i.ytimg.com/vi/OFZp_IsIBxw/default.jpg,https://i.ytimg.com/vi/OFZp_IsIBxw/mqdefault.jpg,https://i.ytimg.com/vi/OFZp_IsIBxw/hqdefault.jpg,none
YAXdMb1Znvw,UCKIEPfI9D32EnsP6oasduSg,Alljit สุขภาพจิตใจ,2021-10-14T14:00:19Z,คนที่เห็น ร่าเริง เฮฮา เขาจะเป็นโรคซึมเศร้าได้จริงหรอ?,คนที่เห็น ร่าเริง เฮฮา เขาจะเป็นโรคซึมเศร้าได้จริงหรอ? 00:00 l เริ่ม 00:30 l ภาวะซึมเศร้า 01:40 l คนที่เฮฮา ...,https://i.ytimg.com/vi/YAXdMb1Znvw/default.jpg,https://i.ytimg.com/vi/YAXdMb1Znvw/mqdefault.jpg,https://i.ytimg.com/vi/YAXdMb1Znvw/hqdefault.jpg,none
MBZ2Mql8yPk,UCKIEPfI9D32EnsP6oasduSg,Alljit สุขภาพจิตใจ,2021-10-13T13:45:11Z,บ้านไม่ใช่ Comfort Zone เราจะสร้างคอมฟอร์ตโซน ให้ตัวเองได้อย่างไร?,บ้านไม่ใช่ Comfort Zone เราจะสร้างคอมฟอร์ตโซน ให้ตัวเองได้อย่างไร? 00:00 l เริ่ม 00:35 l ถ้ารู้สึกว่าครอบครัวไม่ใช่ Safe zone 06:40 l ...,https://i.ytimg.com/vi/MBZ2Mql8yPk/default.jpg,https://i.ytimg.com/vi/MBZ2Mql8yPk/mqdefault.jpg,https://i.ytimg.com/vi/MBZ2Mql8yPk/hqdefault.jpg,none
j5aBwjb-J-U,UCKIEPfI9D32EnsP6oasduSg,Alljit สุขภาพจิตใจ,2021-10-12T14:00:14Z,ทำไมยัง ฝันถึงแฟนเก่า ทั้งๆที่เลิกกันนานแล้ว และไม่ได้คิดถึงแล้ว,ทำไมยัง ฝันถึงแฟนเก่า ทั้งๆที่เลิกกันนานแล้ว และไม่ได้คิดถึงแล้ว 00:00 l เริ่ม 00:40 l ฝันถึงแฟนเก่าบ่อยๆเกิดขึ้นได้อย่างไร ? 05:00 l ...,https://i.ytimg.com/vi/j5aBwjb-J-U/default.jpg,https://i.ytimg.com/vi/j5aBwjb-J-U/mqdefault.jpg,https://i.ytimg.com/vi/j5aBwjb-J-U/hqdefault.jpg,none
doXqIUJlD-4,UCKIEPfI9D32EnsP6oasduSg,Alljit สุขภาพจิตใจ,2021-10-11T13:30:13Z,ทำไมเราถึงต้องให้อภัย คนที่ทำให้เราเจ็บปวด บางทีไม่ได้ทำเพื่อเขา แต่ควรทำเพื่อเรา,เราจะให้อภัยคนที่ใจร้ายกับเราได้ยังไง ให้อภัยคนที่ทำไม่ดีกับเรา อยากให้ใจเราเบาขึ้น 00:00 l เริ่ม 02:20 l ...,https://i.ytimg.com/vi/doXqIUJlD-4/default.jpg,https://i.ytimg.com/vi/doXqIUJlD-4/mqdefault.jpg,https://i.ytimg.com/vi/doXqIUJlD-4/hqdefault.jpg,none
Xm44Q0e3ZEU,UCKIEPfI9D32EnsP6oasduSg,Alljit สุขภาพจิตใจ,2021-10-10T14:45:11Z,เพิ่มภูมิคุ้มกันทางจิตใจ ด้วยการมองเห็นและรับรู้คุณค่าในตนเอง - ฟังก่อนนอน EP.7,Alljit ร่วมกับคุณวันเฉลิม คงคาหลวง (นักจิตวิทยาการปรึกษา) เจ้าของแฟนเพจ Trust.นักจิตวิทยาการปรึกษา เพิ่มภูมิคุ้มกันทางจิตใจ ...,https://i.ytimg.com/vi/Xm44Q0e3ZEU/default.jpg,https://i.ytimg.com/vi/Xm44Q0e3ZEU/mqdefault.jpg,https://i.ytimg.com/vi/Xm44Q0e3ZEU/hqdefault.jpg,none
uMoFVw9oGnU,UCKIEPfI9D32EnsP6oasduSg,Alljit สุขภาพจิตใจ,2021-10-09T14:45:11Z,การค้นหาความรู้สึกแย่ๆ ที่อยู่ภายในใจ ให้หายกังวล - ฟังก่อนนอน EP.6,Alljit ร่วมกับคุณวันเฉลิม คงคาหลวง (นักจิตวิทยาการปรึกษา) เจ้าของแฟนเพจ Trust.นักจิตวิทยาการปรึกษา การค้นหาความรู้สึกแย่ๆ ที่อยู่ภายในใจ ...,https://i.ytimg.com/vi/uMoFVw9oGnU/default.jpg,https://i.ytimg.com/vi/uMoFVw9oGnU/mqdefault.jpg,https://i.ytimg.com/vi/uMoFVw9oGnU/hqdefault.jpg,none
3eHV7gbTG3U,UCKIEPfI9D32EnsP6oasduSg,Alljit สุขภาพจิตใจ,2021-10-09T12:45:15Z,ชอบคิดฟุ้งซ่าน ชอบคิดมาก จนนอนไม่หลับ นอนหลับไม่สนิท ทำอย่างไรดี?,ชอบคิดฟุ้งซ่าน ชอบคิดมาก จนนอนไม่หลับ นอนหลับไม่สนิท ทำอย่างไรดี? 00:00 l เริ่ม 01:10 l เพราะอะไรเราถึงนอนไม่หลับ ? 06:30 l ...,https://i.ytimg.com/vi/3eHV7gbTG3U/default.jpg,https://i.ytimg.com/vi/3eHV7gbTG3U/mqdefault.jpg,https://i.ytimg.com/vi/3eHV7gbTG3U/hqdefault.jpg,none
V429tqNVRJQ,UCKIEPfI9D32EnsP6oasduSg,Alljit สุขภาพจิตใจ,2021-10-08T14:45:12Z,การให้อภัยคนที่เคยใจร้ายกับเรา ไม่ใช่เพื่อเขา แต่ทำเพื่อให้ใจเราเบาขึ้น - ฟังก่อนนอน EP.5,Alljit ร่วมกับคุณวันเฉลิม คงคาหลวง (นักจิตวิทยาการปรึกษา) เจ้าของแฟนเพจ Trust.นักจิตวิทยาการปรึกษา การให้อภัยคนที่เคยใจร้ายกับเรา ...,https://i.ytimg.com/vi/V429tqNVRJQ/default.jpg,https://i.ytimg.com/vi/V429tqNVRJQ/mqdefault.jpg,https://i.ytimg.com/vi/V429tqNVRJQ/hqdefault.jpg,none
exGUK1u7Iu4,UCKIEPfI9D32EnsP6oasduSg,Alljit สุขภาพจิตใจ,2021-10-08T12:30:13Z,เป็นคนชอบเอาชนะทำอย่างไรดี? เพราะรู้สึกไม่ได้มีความสุขกับมันเลย,เป็นคนชอบเอาชนะทำอย่างไรดี? เพราะรู้สึกไม่ได้มีความสุขกับมันเลย 00:00 l เริ่ม 00:39 l เราเป็นคนมีนิสัยชอบเอาชนะหรือเปล่า ? 07:05 l ...,https://i.ytimg.com/vi/exGUK1u7Iu4/default.jpg,https://i.ytimg.com/vi/exGUK1u7Iu4/mqdefault.jpg,https://i.ytimg.com/vi/exGUK1u7Iu4/hqdefault.jpg,none
AyQaXQS2EFU,UCKIEPfI9D32EnsP6oasduSg,Alljit สุขภาพจิตใจ,2021-10-07T14:30:12Z,คุณคือใคร? Podcast ที่ช่วยให้คุณรู้จักตัวเองมากขึ้น  - ฟังก่อนนอน EP.4,Alljit ร่วมกับคุณวันเฉลิม คงคาหลวง (นักจิตวิทยาการปรึกษา) เจ้าของแฟนเพจ Trust.นักจิตวิทยาการปรึกษา อยากรู้จักตัวเองมากยิ่งขึ้น ...,https://i.ytimg.com/vi/AyQaXQS2EFU/default.jpg,https://i.ytimg.com/vi/AyQaXQS2EFU/mqdefault.jpg,https://i.ytimg.com/vi/AyQaXQS2EFU/hqdefault.jpg,none
-cd_OMv1GOA,UCKIEPfI9D32EnsP6oasduSg,Alljit สุขภาพจิตใจ,2021-10-07T12:15:28Z,อย่าเก็บคำพูดคนอื่นมาคิด พูดง่ายแต่ทำยาก ถ้าไม่อยากเก็บคนพูดคนอื่นมาคิด ต้องทำอย่างไร?,อย่าเก็บคำพูดคนอื่นมาคิด พูดง่ายแต่ทำยาก ถ้าไม่อยากเก็บคนพูดคนอื่นมาคิด ต้องทำอย่างไร? 00:00 l เริ่ม 01:00 l ...,https://i.ytimg.com/vi/-cd_OMv1GOA/default.jpg,https://i.ytimg.com/vi/-cd_OMv1GOA/mqdefault.jpg,https://i.ytimg.com/vi/-cd_OMv1GOA/hqdefault.jpg,none
xEqXRc_yhsQ,UCKIEPfI9D32EnsP6oasduSg,Alljit สุขภาพจิตใจ,2021-10-06T14:45:12Z,ช่วงนี้คุณมีความสุขอยู่ไหม? สำรวจหัวใจตัวเองก่อนนอน - ฟังก่อนนอน EP.3,Alljit ร่วมกับคุณวันเฉลิม คงคาหลวง (นักจิตวิทยาการปรึกษา) เจ้าของแฟนเพจ Trust.นักจิตวิทยาการปรึกษา 00:00 | เริ่ม 01:00 ...,https://i.ytimg.com/vi/xEqXRc_yhsQ/default.jpg,https://i.ytimg.com/vi/xEqXRc_yhsQ/mqdefault.jpg,https://i.ytimg.com/vi/xEqXRc_yhsQ/hqdefault.jpg,none
66HM9LaCnQw,UCKIEPfI9D32EnsP6oasduSg,Alljit สุขภาพจิตใจ,2021-10-06T13:00:14Z,ไม่ชอบนิสัยคนในครอบครัว ทำอย่างไรดี? เมื่อไม่อยากจะทนอีกต่อไป,ไม่ชอบนิสัยคนในครอบครัว ทำอย่างไรดี? เมื่อไม่อยากจะทนอีกต่อไป 00:00 l เริ่ม 02:20 l ทำอย่างไรดีถ้าเราไม่ชอบนิสัยคนในครอบครัว ? 21:45 l ...,https://i.ytimg.com/vi/66HM9LaCnQw/default.jpg,https://i.ytimg.com/vi/66HM9LaCnQw/mqdefault.jpg,https://i.ytimg.com/vi/66HM9LaCnQw/hqdefault.jpg,none
smrI5r4U97c,UCKIEPfI9D32EnsP6oasduSg,Alljit สุขภาพจิตใจ,2021-10-06T12:36:23Z,ค้นเข้าไปภายในหัวใจก่อนนอน วันนี้เราลืมอะไรไปหรือเปล่า - ฟังก่อนนอน EP.2,Alljit ร่วมกับคุณวันเฉลิม คงคาหลวง (นักจิตวิทยาการปรึกษา) เจ้าของแฟนเพจ Trust.นักจิตวิทยาการปรึกษา 00:00 | เริ่ม 00:26 ...,https://i.ytimg.com/vi/smrI5r4U97c/default.jpg,https://i.ytimg.com/vi/smrI5r4U97c/mqdefault.jpg,https://i.ytimg.com/vi/smrI5r4U97c/hqdefault.jpg,none
6e-UhblR96E,UCKIEPfI9D32EnsP6oasduSg,Alljit สุขภาพจิตใจ,2021-10-06T08:32:22Z,เคลียร์ใจก่อนนอน ให้เรานอนหลับง่ายมากขึ้น - ฟังก่อนนอน EP.1,เคลียร์เรื่องลบๆ ภายในใจที่ทำให้เรานอนไม่หลับ ทำให้เราหลับง่ายขึ้น - ฟังก่อนนอน EP.1 Alljit ร่วมกับคุณวันเฉลิม คงคาหลวง ...,https://i.ytimg.com/vi/6e-UhblR96E/default.jpg,https://i.ytimg.com/vi/6e-UhblR96E/mqdefault.jpg,https://i.ytimg.com/vi/6e-UhblR96E/hqdefault.jpg,none
MNwS5_CuJQI,UCKIEPfI9D32EnsP6oasduSg,Alljit สุขภาพจิตใจ,2021-10-05T13:00:15Z,ทำอย่างไร เมื่อความรัก ไม่ถูกใจคนในครอบครัว..,ทำอย่างไร เมื่อความรัก ไม่ถูกใจคนในครอบครัว.. 00:00 l เริ่ม 00:50 l ทำความเข้าใจในวัฒนธรรมของแต่ละครอบครัว 03:00 l ...,https://i.ytimg.com/vi/MNwS5_CuJQI/default.jpg,https://i.ytimg.com/vi/MNwS5_CuJQI/mqdefault.jpg,https://i.ytimg.com/vi/MNwS5_CuJQI/hqdefault.jpg,none
pxtEdDiu4nc,UCKIEPfI9D32EnsP6oasduSg,Alljit สุขภาพจิตใจ,2021-10-04T14:00:15Z,แบบไหนควรพบนักจิตวิทยา ต้องเตรียมตัวอย่างไรก่อนเข้าพบนักจิตวิทยา,ต้องเตรียมตัวอย่างไรหากอยากปรึกษาสุขภาพจิต แบบไหนถึงพบนักจิตวิทยา 00:00 l เริ่ม 00:50 l ปกติหรือไม่ปกติแยกอย่างไร ? 07:15 l ...,https://i.ytimg.com/vi/pxtEdDiu4nc/default.jpg,https://i.ytimg.com/vi/pxtEdDiu4nc/mqdefault.jpg,https://i.ytimg.com/vi/pxtEdDiu4nc/hqdefault.jpg,none
ztOEvFdCxh4,UCKIEPfI9D32EnsP6oasduSg,Alljit สุขภาพจิตใจ,2021-10-03T14:00:12Z,วิธีเลิกแคร์คนอื่น ว่าเขาจะมองเราอย่างไร? เลิกกลัวว่าเขา จะไม่ชอบเรา,วิธีการเลิกแคร์คนอื่น ว่าเขาจะมองเราอย่างไร? เลิกกลัวว่าเขา จะไม่ชอบเรา เพราะมีหลายครั้งที่ เราแคร์คนอื่นมากเกินไป ...,https://i.ytimg.com/vi/ztOEvFdCxh4/default.jpg,https://i.ytimg.com/vi/ztOEvFdCxh4/mqdefault.jpg,https://i.ytimg.com/vi/ztOEvFdCxh4/hqdefault.jpg,none
mqWYNnE6HKg,UCKIEPfI9D32EnsP6oasduSg,Alljit สุขภาพจิตใจ,2021-10-02T15:08:26Z,รวม Podcast จิตวิทการนอนหลับและความฝัน แก้ปัญหานอนไม่หลับ - Long Play,รวม Podcast จิตวิทการนอนหลับและความฝัน แก้ปัญหานอนไม่หลับ - Long Play 00:00 | เริ่ม 00:10 | ความฝันเกิดจากอะไร? 18:00 ...,https://i.ytimg.com/vi/mqWYNnE6HKg/default.jpg,https://i.ytimg.com/vi/mqWYNnE6HKg/mqdefault.jpg,https://i.ytimg.com/vi/mqWYNnE6HKg/hqdefault.jpg,none
mEnS_CruGZo,UCKIEPfI9D32EnsP6oasduSg,Alljit สุขภาพจิตใจ,2021-10-02T13:29:13Z,เข้าใจเด็กบ้าง.. ความเครียดในวัยรุ่น ไม่ใช่เรื่องเล็ก ไม่ใช่เรื่องไร้สาระ,เข้าใจเด็กบ้าง.. ความเครียดในวัยรุ่น ไม่ใช่เรื่องเล็ก ไม่ใช่เรื่องไร้สาระ 00:00 l เริ่ม 01:40 l เข้าใจความเครียดในวัยรุ่น 07:45 l ...,https://i.ytimg.com/vi/mEnS_CruGZo/default.jpg,https://i.ytimg.com/vi/mEnS_CruGZo/mqdefault.jpg,https://i.ytimg.com/vi/mEnS_CruGZo/hqdefault.jpg,none
2ngSlTLBG9M,UCKIEPfI9D32EnsP6oasduSg,Alljit สุขภาพจิตใจ,2021-10-02T07:32:25Z,รวม Podcast สำหรับคนคิดมาก คนที่ชอบเก็บทุกเรื่องมาคิด - Long Play,รวม Podcast สำหรับคนคิดมาก คนที่ชอบเก็บทุกเรื่องมาคิด คิดมาจนเครียด คิดมากจนนอนไม่หลับ รวม Podcast จาก 4 ตอนสำคัญรวบมาไว้บน ...,https://i.ytimg.com/vi/2ngSlTLBG9M/default.jpg,https://i.ytimg.com/vi/2ngSlTLBG9M/mqdefault.jpg,https://i.ytimg.com/vi/2ngSlTLBG9M/hqdefault.jpg,none
