videoId,channelId,channelTitle,publishTime,title,description,thumbnail_default,thumbnail_medium,thumbnail_high,liveBroadcastContent
XDElGbGXVNs,UCKIEPfI9D32EnsP6oasduSg,Alljit สุขภาพจิตใจ,2022-08-24T08:43:04Z,ความเครียด จิตวิทยาจัดการความเครียด รับมืออย่างไรเมื่อเครียดเกินไป,เครียด” คำยอดฮิตที่ทุกคนพูดกัน ปฏิเสธไม่ได้เลยว่าบางคนอาจจะพูดคำนี้แทบทุกวัน เพื่อระบายสิ่งต่างๆที่เราเจอหรือเรื่องราวที่เราต้องเผชิญ ...,https://i.ytimg.com/vi/XDElGbGXVNs/default.jpg,https://i.ytimg.com/vi/XDElGbGXVNs/mqdefault.jpg,https://i.ytimg.com/vi/XDElGbGXVNs/hqdefault.jpg,none
zlt73mXhfac,UCKIEPfI9D32EnsP6oasduSg,Alljit สุขภาพจิตใจ,2022-08-23T15:19:25Z,ชวนสมัครสมาชิก Alljit ร่วมเป็นครอบครัวเดียวกัน,ชวนสมัครสมาชิก Alljit ร่วมเป็นครอบครัวเดียวกัน สามารถเป็นผู้สนับสนุนช่อง Alljit ได้แล้ววันนี้ ...,https://i.ytimg.com/vi/zlt73mXhfac/default.jpg,https://i.ytimg.com/vi/zlt73mXhfac/mqdefault.jpg,https://i.ytimg.com/vi/zlt73mXhfac/hqdefault.jpg,none
3-AzYcO2XqE,UCKIEPfI9D32EnsP6oasduSg,Alljit สุขภาพจิตใจ,2022-08-22T14:02:16Z,ฟังก่อนนอน สำรวจจิตใจให้หลับสนิท เคลียร์สิงรบกวนภายในใจที่ทำให้เราคิดมาก - Long Play,ฟังก่อนนอน #นอนไม่หลับ สำรวจจิตใจให้หลับสนิท เคลียร์สิงรบกวนภายในใจที่ทำให้เราคิดมาก - Long Play 00:00 l เริ่ม 00:01 l ...,https://i.ytimg.com/vi/3-AzYcO2XqE/default.jpg,https://i.ytimg.com/vi/3-AzYcO2XqE/mqdefault.jpg,https://i.ytimg.com/vi/3-AzYcO2XqE/hqdefault.jpg,none
xm7dN4i6jcw,UCKIEPfI9D32EnsP6oasduSg,Alljit สุขภาพจิตใจ,2022-08-21T15:25:59Z,ความสุขคืออะไร ยิ่งตามหาความสุข ยิ่งหาไม่เจอ,ความสุขยิ่งตามหายิ่งเหนื่อย” “ความสุขยิ่งตามหายิ่งไม่เจอ” แต่ถ้าในวันที่เราทุกข์ใจจนมองหาความสุขไม่เจอ ...,https://i.ytimg.com/vi/xm7dN4i6jcw/default.jpg,https://i.ytimg.com/vi/xm7dN4i6jcw/mqdefault.jpg,https://i.ytimg.com/vi/xm7dN4i6jcw/hqdefault.jpg,none
UwXizVbeyag,UCKIEPfI9D32EnsP6oasduSg,Alljit สุขภาพจิตใจ,2022-08-19T10:31:07Z,หมดพลังใจ ไวเหลือเกิน คนพลังงานน้อย,ใช้ชีวิตไม่ถึงครึ่งวันร่างกายและจิตใจก็เหมือนแบตจะหมดทุกที นี่เราเป็นคนพลังงานน้อยหรือแค่เหนื่อยกับอะไรบางอย่างจนล้าไปทั้งกายใจกันนะ?,https://i.ytimg.com/vi/UwXizVbeyag/default.jpg,https://i.ytimg.com/vi/UwXizVbeyag/mqdefault.jpg,https://i.ytimg.com/vi/UwXizVbeyag/hqdefault.jpg,none
sq2Xgx-Gj9g,UCKIEPfI9D32EnsP6oasduSg,Alljit สุขภาพจิตใจ,2022-08-18T15:24:45Z,ยิ่งดึกยิ่งเหงา ยิ่งหนาวยิ่งรู้สึกเศร้า อาการเศร้าตามอากาศ,อากาศที่เปลี่ยนแปลง อารมณ์และความรู้สึกเลยเปลี่ยนตาม ...,https://i.ytimg.com/vi/sq2Xgx-Gj9g/default.jpg,https://i.ytimg.com/vi/sq2Xgx-Gj9g/mqdefault.jpg,https://i.ytimg.com/vi/sq2Xgx-Gj9g/hqdefault.jpg,none
eg0uMlvzDUI,UCKIEPfI9D32EnsP6oasduSg,Alljit สุขภาพจิตใจ,2022-08-17T13:51:39Z,ภาวะ Dead Inside ข้างนอกเหมือนโอเค แต่ข้างในว่างเปล่า,มองไปข้างหน้าแต่ไม่เห็นอะไรเลย” หลายๆคนคงเคยมีความรู้สึกเบื่อ เหนื่อย หรือไม่อยากทำอะไรซึ่งเป็นเรื่องธรรมดาที่เรารู้สึกกัน ...,https://i.ytimg.com/vi/eg0uMlvzDUI/default.jpg,https://i.ytimg.com/vi/eg0uMlvzDUI/mqdefault.jpg,https://i.ytimg.com/vi/eg0uMlvzDUI/hqdefault.jpg,none
BTEQ8ZR6ETQ,UCKIEPfI9D32EnsP6oasduSg,Alljit สุขภาพจิตใจ,2022-08-16T13:57:00Z,พูดคนเดียวแปลกไหม ? ใครชอบพูดคนเดียวบ้าง,คุยกับแม่ซื้อเหรอ? ” คำถามที่เรามักจะถูกถามเวลาที่เราแอบพึมพัมกับตัวเองแล้วคนอื่นแอบได้ยิน ...,https://i.ytimg.com/vi/BTEQ8ZR6ETQ/default.jpg,https://i.ytimg.com/vi/BTEQ8ZR6ETQ/mqdefault.jpg,https://i.ytimg.com/vi/BTEQ8ZR6ETQ/hqdefault.jpg,none
MZhGdDZB7V4,UCKIEPfI9D32EnsP6oasduSg,Alljit สุขภาพจิตใจ,2022-08-15T13:18:49Z,จิตวิทยาลืมแฟนเก่า ทำไมยังคิดถึงแฟนเก่าอยู่ และทำไมเราต้องลืม,ยิ่งอยากลืม กลับยิ่งจำ” เคยสงสัยไหมว่า ทำไมการพยายามที่จะลืมเเฟนเก่า กลับยิ่งเหมือนรื้อความทรงจำที่มีร่วมกันจนทำให้เราคิดถึง ...,https://i.ytimg.com/vi/MZhGdDZB7V4/default.jpg,https://i.ytimg.com/vi/MZhGdDZB7V4/mqdefault.jpg,https://i.ytimg.com/vi/MZhGdDZB7V4/hqdefault.jpg,none
7vHTD6CiaDo,UCKIEPfI9D32EnsP6oasduSg,Alljit สุขภาพจิตใจ,2022-08-14T16:57:59Z,แม้อาจไม่ดีพร้อม แต่เธอดีพอนะ Turning Red,Turning Red เขินแรงแดงเป็นแพนด้า” จากดิสนีย์และพิกซาร์ สตูดิโอ เรื่องราวของ เมยหลิน ลี (Meilin Lee) หรือ เหม่ยลี่ เด็กผู้หญิงวัย 13 ปี ...,https://i.ytimg.com/vi/7vHTD6CiaDo/default.jpg,https://i.ytimg.com/vi/7vHTD6CiaDo/mqdefault.jpg,https://i.ytimg.com/vi/7vHTD6CiaDo/hqdefault.jpg,none
ReyfSG5IQQQ,UCKIEPfI9D32EnsP6oasduSg,Alljit สุขภาพจิตใจ,2022-08-13T15:28:38Z,เสพติดการช้อปปิ้ง Shopaholic ขอแค่ได้ซื้อก็มีความสุข,เคยไหม? เวลาที่เจอกับความเครียดที่เข้ามาในชีวิต เรามักที่จะ Shopping เพื่อระบายความเครียด ถ้าหากเสพติดการ Shop จน Control ตัวเองไม่ได้ ...,https://i.ytimg.com/vi/ReyfSG5IQQQ/default.jpg,https://i.ytimg.com/vi/ReyfSG5IQQQ/mqdefault.jpg,https://i.ytimg.com/vi/ReyfSG5IQQQ/hqdefault.jpg,none
njelAcfzU4g,UCKIEPfI9D32EnsP6oasduSg,Alljit สุขภาพจิตใจ,2022-08-12T11:43:57Z,จิตวิทยาความขี้เกียจ เพราะอะไรเราถึงขี้เกียจ ผิดไหมหากเรารู้สึกขี้เกียจ,"""ขี้เกียจตื่น ขี้เกียจไปโรงเรียน ขี้เกียจไปทำงาน"" ไม่ว่าจะช่วงเวลาไหนของชีวิตเราก็คงเคยมีความรู้สึกขี้เกียจกันทั้งนั้น แม้กระทั่งการตื่นนอน ...",https://i.ytimg.com/vi/njelAcfzU4g/default.jpg,https://i.ytimg.com/vi/njelAcfzU4g/mqdefault.jpg,https://i.ytimg.com/vi/njelAcfzU4g/hqdefault.jpg,none
x1QBT4Ab4kA,UCKIEPfI9D32EnsP6oasduSg,Alljit สุขภาพจิตใจ,2022-08-11T11:12:59Z,คน Introvert มีความสุขเมื่อได้อยู่ตามลำพัง มีความสุขที่ได้อยู่คนเดียว จริงหรือเปล่า,คน Introvert มักจะถูกมองว่าเป็นคนขี้อาย กลัวสังคมและไม่มีเพื่อน หลายคนอาจจะเกิดความสงสัยขึ้นว่าแล้วพวกเขาเป็นแบบนั้นจริงหรือเปล่า?,https://i.ytimg.com/vi/x1QBT4Ab4kA/default.jpg,https://i.ytimg.com/vi/x1QBT4Ab4kA/mqdefault.jpg,https://i.ytimg.com/vi/x1QBT4Ab4kA/hqdefault.jpg,none
XoRcCr1NSWI,UCKIEPfI9D32EnsP6oasduSg,Alljit สุขภาพจิตใจ,2022-08-10T10:24:40Z,การคิดบวก คืออะไร? ในทางจิตวิทยา เราต้องคิดบวกจริงๆ หรอ,"""คิดบวก คิดในแง่ดี โลกสวย"" คำเหล่านี้ที่เรามักจะได้ยินกันบ่อยๆ ...",https://i.ytimg.com/vi/XoRcCr1NSWI/default.jpg,https://i.ytimg.com/vi/XoRcCr1NSWI/mqdefault.jpg,https://i.ytimg.com/vi/XoRcCr1NSWI/hqdefault.jpg,none
2rbzFAfvPaM,UCKIEPfI9D32EnsP6oasduSg,Alljit สุขภาพจิตใจ,2022-08-09T10:34:26Z,หงุดหงิด เหวี่ยง วีน แบบไม่รู้ตัวเป็นเพราะนิสัยส่วนตัว หรือรอบเดือนกันแน่นะ?,เคยไหม ? หงุดหงิด เศร้า อ่อนไหว อารมณ์ไม่คงที่ก่อนเป็นประจำเดือน จนบางครั้งกระทบต่อคนรอบ ๆ ตัว แล้วอาการเหล่านี้เกิดจากอะไรกันนะ ?,https://i.ytimg.com/vi/2rbzFAfvPaM/default.jpg,https://i.ytimg.com/vi/2rbzFAfvPaM/mqdefault.jpg,https://i.ytimg.com/vi/2rbzFAfvPaM/hqdefault.jpg,none
1tfAGwMra2I,UCKIEPfI9D32EnsP6oasduSg,Alljit สุขภาพจิตใจ,2022-08-07T15:25:05Z,เซฟโซน ไม่ใช่สถานที่ แต่ Safe Zone คืออะไร? ไม่มีเซฟโซนของตัวเอง,เพื่อนไม่ใช่เซฟโซน แฟนไม่ใช่เซฟโซน แมวไม่ใช่เซฟโซน ครอบครัวไม่ใช่เซฟโซน” คำที่นำมาเล่นกันเพื่อสื่อความหมายว่า ...,https://i.ytimg.com/vi/1tfAGwMra2I/default.jpg,https://i.ytimg.com/vi/1tfAGwMra2I/mqdefault.jpg,https://i.ytimg.com/vi/1tfAGwMra2I/hqdefault.jpg,none
RPdV4_9WrfA,UCKIEPfI9D32EnsP6oasduSg,Alljit สุขภาพจิตใจ,2022-08-07T13:02:05Z,จิตวิทยาดูดวง รับมือความกังวลใจ เมื่อดวงไม่ดี,เซียมซีไม่ดีฝากไว้ที่วัด” เคยไหม ? ได้คำทำนายที่ไม่ดีทำให้รู้สึกแย่ จิตตก และเกิดความกังวลต่อสถานการณ์ที่ยังไม่เกิดขึ้น ...,https://i.ytimg.com/vi/RPdV4_9WrfA/default.jpg,https://i.ytimg.com/vi/RPdV4_9WrfA/mqdefault.jpg,https://i.ytimg.com/vi/RPdV4_9WrfA/hqdefault.jpg,none
xkUfwvUyD0Y,UCKIEPfI9D32EnsP6oasduSg,Alljit สุขภาพจิตใจ,2022-08-06T13:35:37Z,การดูดวงกับนักจิตวิทยา ทำไมเราชอบดูดวง หมอดูทำไมแม่นจังเลย,ในวันที่ทุกข์ใจ มองไปทางไหนก็รู้สึกไม่มีที่พึ่งพิง ทำไมบางคนมักจะแก้ปัญหาด้วยการดูดวง ดูแล้วช่วยให้ดีขึ้นจริงไหม ...,https://i.ytimg.com/vi/xkUfwvUyD0Y/default.jpg,https://i.ytimg.com/vi/xkUfwvUyD0Y/mqdefault.jpg,https://i.ytimg.com/vi/xkUfwvUyD0Y/hqdefault.jpg,none
IeKqI8WPGuQ,UCKIEPfI9D32EnsP6oasduSg,Alljit สุขภาพจิตใจ,2022-08-05T13:40:25Z,ยิ้มไม่ได้แปลว่ามีความสุข เฮฮาแต่อาจเป็น &#39;โรคซึมเศร้า&#39; ความเศร้ากับโรคซึมเศร้า,คนบางคนที่เรามองเห็นว่า เขาก็ดูเฮฮา ดูมีความสุขดีนี่นา ทำไมถึงเป็นซึมเศร้าได้ เเล้วคำว่า โรคซึมเศร้า ต้องเศร้าตลอดเวลาเลยไหม ...,https://i.ytimg.com/vi/IeKqI8WPGuQ/default.jpg,https://i.ytimg.com/vi/IeKqI8WPGuQ/mqdefault.jpg,https://i.ytimg.com/vi/IeKqI8WPGuQ/hqdefault.jpg,none
_dBG0RKlpx0,UCKIEPfI9D32EnsP6oasduSg,Alljit สุขภาพจิตใจ,2022-08-04T17:03:05Z,อกหักไม่ถึงตาย จริงหรอ? ทำไมไม่รู้สึกแบบนั้น จากใจนักจิตวิทยา,"ใครๆก็ต้องเคยอกหัก ร้องไห้แทบตาย แต่สุดท้ายก็ไปกันไม่ได้อยู่ดี ""อกหักไม่ถึงตาย"" คำที่มักจะใช้พูดเพื่อปลอบใจคนที่กำลังอกหัก ...",https://i.ytimg.com/vi/_dBG0RKlpx0/default.jpg,https://i.ytimg.com/vi/_dBG0RKlpx0/mqdefault.jpg,https://i.ytimg.com/vi/_dBG0RKlpx0/hqdefault.jpg,none
0uN--0AfdV4,UCKIEPfI9D32EnsP6oasduSg,Alljit สุขภาพจิตใจ,2022-08-03T14:28:07Z,เรากำลังใช้ชีวิตของเราอยู่หรือเปล่า หรือเรากำลังใช้ชีวิตแบบนี้ เพราะใครบางคน,เรามักจะไม่ได้ใช้ชีวิตตามที่ตัวเองต้องการ แต่เรามักจะใช้ชีวิตตามที่คนอื่นต้องการ ...,https://i.ytimg.com/vi/0uN--0AfdV4/default.jpg,https://i.ytimg.com/vi/0uN--0AfdV4/mqdefault.jpg,https://i.ytimg.com/vi/0uN--0AfdV4/hqdefault.jpg,none
-IE_VPJ3LLA,UCKIEPfI9D32EnsP6oasduSg,Alljit สุขภาพจิตใจ,2022-08-02T15:48:48Z,ก้าวผ่านเหตุการณ์ร้ายๆ ได้อย่างสวยงาม,เวลาที่เราเจอเรื่องร้ายๆหรือผ่านเหตุการณ์สะเทือนใจมา เป็นเรื่องธรรมดาที่เราจะเกิดความกลัวและขวัญเสียในช่วงเวลานั้นๆ ...,https://i.ytimg.com/vi/-IE_VPJ3LLA/default.jpg,https://i.ytimg.com/vi/-IE_VPJ3LLA/mqdefault.jpg,https://i.ytimg.com/vi/-IE_VPJ3LLA/hqdefault.jpg,none
laOKN7jffwM,UCKIEPfI9D32EnsP6oasduSg,Alljit สุขภาพจิตใจ,2022-08-02T05:47:14Z,อยากมีความสุขในการทำงาน เริ่มต้นได้อย่างไร? จิตวิทยาในการทำงาน,ทุก ๆ คนก็อยากทำงานที่ทำให้เรามีความสุข ทั้งบรรยากาศการทำงาน งานที่เราทำ เพื่อนร่วมงานก็ส่งผลให้เรามีความสุขกับการทำงาน ...,https://i.ytimg.com/vi/laOKN7jffwM/default.jpg,https://i.ytimg.com/vi/laOKN7jffwM/mqdefault.jpg,https://i.ytimg.com/vi/laOKN7jffwM/hqdefault.jpg,none
C4BDjipQeEA,UCKIEPfI9D32EnsP6oasduSg,Alljit สุขภาพจิตใจ,2022-08-01T05:26:43Z,อาชีพบุคสาธารณะ อาชีพดารา นักแสดง นักร้อง เสี่ยงเป็นโรคซึมเศร้าสูงหรือไม่?,นักแสดง ดารา นักร้องที่อยู่ในสปอตไลท์ มีทั้งความคาดหวัง ความกดดัน ทั้งคำวิพากวิจารณ์ จนส่งผลกระทบต่อสุขภาพจิตอาจถึงขั้นซึมเศร้า ...,https://i.ytimg.com/vi/C4BDjipQeEA/default.jpg,https://i.ytimg.com/vi/C4BDjipQeEA/mqdefault.jpg,https://i.ytimg.com/vi/C4BDjipQeEA/hqdefault.jpg,none
wSKBgO9Sq3s,UCKIEPfI9D32EnsP6oasduSg,Alljit สุขภาพจิตใจ,2022-07-31T08:44:38Z,ไม่ค่อยมั่นใจในรูปร่างตัวเอง ไม่ชอบตัวเอง,เคยไหม ? เปรียบเทียบรูปร่างตัวเองกับคนอื่น จนทำให้รู้สึกแย่กับตัวเอง.. เรากำลังแคร์สายตาคนอื่นมากเกินไปจนกระทบต่อสุขภาพจิตอยู่หรือเปล่า ?,https://i.ytimg.com/vi/wSKBgO9Sq3s/default.jpg,https://i.ytimg.com/vi/wSKBgO9Sq3s/mqdefault.jpg,https://i.ytimg.com/vi/wSKBgO9Sq3s/hqdefault.jpg,none
eTslKiUCRb4,UCKIEPfI9D32EnsP6oasduSg,Alljit สุขภาพจิตใจ,2022-07-29T12:48:37Z,หมดไฟในการทำงาน  ภาวะ Burnout Syndrome,เคยไหม ? รู้สึกเกลียดวันจันทร์เพียงเพราะต้องตื่นไปทำงาน.. ผลตอบแทน เพื่อนร่วมงาน ...,https://i.ytimg.com/vi/eTslKiUCRb4/default.jpg,https://i.ytimg.com/vi/eTslKiUCRb4/mqdefault.jpg,https://i.ytimg.com/vi/eTslKiUCRb4/hqdefault.jpg,none
8tvxh3fL9u4,UCKIEPfI9D32EnsP6oasduSg,Alljit สุขภาพจิตใจ,2022-07-29T08:10:32Z,จิตวิทยาดูดวง ทำไมอุ่นใจเมื่อมีของขลัง วัตถุมงคล,มนุษย์เราเติบโตมาพร้อมกับความไม่รู้ หากมีเรื่องอะไรไม่สบายใจหรือคาดการณ์ไม่ได้ ไม่ว่าจะเป็นเรื่องของโชคชะตา ความรัก สุขภาพ การงาน ...,https://i.ytimg.com/vi/8tvxh3fL9u4/default.jpg,https://i.ytimg.com/vi/8tvxh3fL9u4/mqdefault.jpg,https://i.ytimg.com/vi/8tvxh3fL9u4/hqdefault.jpg,none
kJXypXWFfas,UCKIEPfI9D32EnsP6oasduSg,Alljit สุขภาพจิตใจ,2022-07-28T14:02:50Z,บาดแผลทางใจในวัยเด็ก อาจส่งผลกับคนๆ หนึ่ง ไปตลอดกาล,การที่เด็กซักคนเติบโตขึ้นมา ประสบการณ์ที่เขาเจอหรือสิ่งต่าง ๆ ที่เกิดขึ้น มักจะสร้างตัวตนที่เขาเป็น.. การที่เรารู้สึกเจ็บปวดทางจิตใจบ่อย ๆ ...,https://i.ytimg.com/vi/kJXypXWFfas/default.jpg,https://i.ytimg.com/vi/kJXypXWFfas/mqdefault.jpg,https://i.ytimg.com/vi/kJXypXWFfas/hqdefault.jpg,none
hItumO_zCqw,UCKIEPfI9D32EnsP6oasduSg,Alljit สุขภาพจิตใจ,2022-07-27T12:49:31Z,นอนไม่หลับ Podcast นี้อาจช่วยได้ เคลียร์สิ่งรบกวนในใจ ที่ทำให้กังวลใจ - Long Play,นอนไม่หลับ Podcast นี้จะพาคุณไปสำรวจตัวเอง เคลียร์สิ่งรบกวนในใจ ที่ทำให้กังวลใจ - Long Play 00:00 l เริ่ม 00:01 l อย่ารู้สึกผิด ...,https://i.ytimg.com/vi/hItumO_zCqw/default.jpg,https://i.ytimg.com/vi/hItumO_zCqw/mqdefault.jpg,https://i.ytimg.com/vi/hItumO_zCqw/hqdefault.jpg,none
NJ37MUsnAUI,UCKIEPfI9D32EnsP6oasduSg,Alljit สุขภาพจิตใจ,2022-07-27T08:05:31Z,คนชอบเกรงใจ People Pleaser อะไรก็ยอม เอาใจคนอื่น แต่กลับฝืนใจตัวเอง,เคยไหม ? ต้องการเป็นที่ยอมรับ เลยทำให้เป็นคนง่าย ๆ อะไรก็ยอม ดูแลเอาใจใส่คนอื่นอยู่ตลอดเวลา ไม่กล้าที่จะปฏิเสธจนตัวเองลำบาก ...,https://i.ytimg.com/vi/NJ37MUsnAUI/default.jpg,https://i.ytimg.com/vi/NJ37MUsnAUI/mqdefault.jpg,https://i.ytimg.com/vi/NJ37MUsnAUI/hqdefault.jpg,none
c8NKPFfBWf8,UCKIEPfI9D32EnsP6oasduSg,Alljit สุขภาพจิตใจ,2022-07-26T08:15:12Z,กฎแรงดึงดูดคืออะไร กฎแรงดึงดูดมีจริงไหม,ความคิดของเราสามารถที่จะดึงดูดสิ่งต่าง ๆ ทั้งดีและไม่ดีเข้ามาในชีวิต ผ่านเหตุการณ์และสถานการณ์ต่าง ๆ การรู้เท่าทันความคิดของตัวเองจึงสำคัญ ...,https://i.ytimg.com/vi/c8NKPFfBWf8/default.jpg,https://i.ytimg.com/vi/c8NKPFfBWf8/mqdefault.jpg,https://i.ytimg.com/vi/c8NKPFfBWf8/hqdefault.jpg,none
28-DMCkOEys,UCKIEPfI9D32EnsP6oasduSg,Alljit สุขภาพจิตใจ,2022-07-25T05:46:29Z,โลกซึมเศร้า อย่าเพิ่งน้อยใจที่ไม่มีใครเข้าใจเรา เพราะบางครั้งเราก็ไม่เข้าใจตัวเอง,โลกซึมเศร้า อย่าเพิ่งน้อยใจที่ไม่มีใครเข้าใจเรา เพราะบางครั้งเราก็ไม่เข้าใจตัวเอง #shorts #โรคซึมเศร้า รวมบทความ สุขภาพใจใน ...,https://i.ytimg.com/vi/28-DMCkOEys/default.jpg,https://i.ytimg.com/vi/28-DMCkOEys/mqdefault.jpg,https://i.ytimg.com/vi/28-DMCkOEys/hqdefault.jpg,none
1U_QQas5jfY,UCKIEPfI9D32EnsP6oasduSg,Alljit สุขภาพจิตใจ,2022-07-25T05:36:21Z,โลกซึมเศร้า ช่วงเวลาที่ยากที่สุด ในตอนที่เป็น โรคซึมเศร้า คืออะไร #shorts,โลกซึมเศร้า ช่วงเวลาที่ยากที่สุด ในตอนที่เป็น โรคซึมเศร้า คืออะไร #shorts รวมบทความ สุขภาพใจใน - https://www.alljitblog.com/ ฟัง Alljit ...,https://i.ytimg.com/vi/1U_QQas5jfY/default.jpg,https://i.ytimg.com/vi/1U_QQas5jfY/mqdefault.jpg,https://i.ytimg.com/vi/1U_QQas5jfY/hqdefault.jpg,none
K5sjA0SCbuA,UCKIEPfI9D32EnsP6oasduSg,Alljit สุขภาพจิตใจ,2022-07-25T05:28:51Z,โลกซึมเศร้า แชร์ประสบการณ์ ความรู้สึกโรคซึมเศร้า เป็นอย่างไร #shorts,โลกซึมเศร้า แชร์ประสบการณ์ ความรู้สึก #โรคซึมเศร้า เป็นอย่างไร #shorts รวมบทความ สุขภาพใจใน - https://www.alljitblog.com/ ฟัง Alljit ...,https://i.ytimg.com/vi/K5sjA0SCbuA/default.jpg,https://i.ytimg.com/vi/K5sjA0SCbuA/mqdefault.jpg,https://i.ytimg.com/vi/K5sjA0SCbuA/hqdefault.jpg,none
