videoId,channelId,channelTitle,publishTime,title,description,thumbnail_default,thumbnail_medium,thumbnail_high,liveBroadcastContent
oAtC4I9Wg1k,UCKIEPfI9D32EnsP6oasduSg,Alljit สุขภาพจิตใจ,2022-03-24T14:30:12Z,หยุดแบกโลกทั้งใบ ไว้กับตัวเอง เพราะมันหนักเกินไป..,หลายครั้ง..เวลาที่เราเกิดปัญหาหรือเกิดความยุ่งยากบางอย่างขึ้นในชีวิต เราเก็บความทุกข์ใจเหล่านั้นไว้กับตัวเองโดยที่เราไม่อยากบอกใคร ...,https://i.ytimg.com/vi/oAtC4I9Wg1k/default.jpg,https://i.ytimg.com/vi/oAtC4I9Wg1k/mqdefault.jpg,https://i.ytimg.com/vi/oAtC4I9Wg1k/hqdefault.jpg,none
Hlt7OI8_e6w,UCKIEPfI9D32EnsP6oasduSg,Alljit สุขภาพจิตใจ,2022-03-20T16:12:17Z,ทำไมรู้สึกเกลียดตัวเองจังเลย รู้สึกเบื่อชีวิตของตัวเอง,การที่เรารู้สึกเกลียดชังตัวเองเป็นความรู้สึกที่เกิดขึ้นจากหลากหลายปัจจัย ...,https://i.ytimg.com/vi/Hlt7OI8_e6w/default.jpg,https://i.ytimg.com/vi/Hlt7OI8_e6w/mqdefault.jpg,https://i.ytimg.com/vi/Hlt7OI8_e6w/hqdefault.jpg,none
VYWy2SZYqq0,UCKIEPfI9D32EnsP6oasduSg,Alljit สุขภาพจิตใจ,2022-03-18T09:35:36Z,เหนื่อยจังเลย ที่พักใจก็ไม่มี หันไปทางไหน ก็ไม่มีคนรับฟัง,คงมีบางช่วงของชีวิตที่เราเจอกับปัญหาต่างๆ แล้วรู้สึกว่าผ่านมันไปได้ยากมากๆและไม่มีใครรับฟัง ไม่มีใครให้พูดคุยแลกเปลี่ยนความคิดเห็น ...,https://i.ytimg.com/vi/VYWy2SZYqq0/default.jpg,https://i.ytimg.com/vi/VYWy2SZYqq0/mqdefault.jpg,https://i.ytimg.com/vi/VYWy2SZYqq0/hqdefault.jpg,none
1AbXFBCwHHI,UCKIEPfI9D32EnsP6oasduSg,Alljit สุขภาพจิตใจ,2022-03-16T13:16:05Z,มีทุกอย่างแล้ว แต่ยังรู้สึกทุกข์ ความสุขของฉันหายไปไหน ?,บางคนมีทุกอย่างพร้อมแล้วแต่ทำไมกลับยังรู้สึกว่าไม่มีความสุขเลย มันเป็นไปได้ยังไงที่คนที่มีทุกอย่างพร้อมแล้วเขาจะยังรู้สึกไม่มีความสุขอยู่ ?,https://i.ytimg.com/vi/1AbXFBCwHHI/default.jpg,https://i.ytimg.com/vi/1AbXFBCwHHI/mqdefault.jpg,https://i.ytimg.com/vi/1AbXFBCwHHI/hqdefault.jpg,none
tTlcKypoCXM,UCKIEPfI9D32EnsP6oasduSg,Alljit สุขภาพจิตใจ,2022-03-14T13:03:27Z,รักแท้.. คุ้มค่ากับการรอคอยเสมอ About Time - ใช้ใจดู EP.10,ในระหว่างทางของการใช้ชีวิตเราเคยทำอะไรผิดพลาดไปบ้างไหม ? จนเรารู้สึกเสียดายมากจนอยากย้อนเวลากลับไปแก้ไขสิ่งนั้น ...,https://i.ytimg.com/vi/tTlcKypoCXM/default.jpg,https://i.ytimg.com/vi/tTlcKypoCXM/mqdefault.jpg,https://i.ytimg.com/vi/tTlcKypoCXM/hqdefault.jpg,none
9SyJUrXUtoI,UCKIEPfI9D32EnsP6oasduSg,Alljit สุขภาพจิตใจ,2022-03-13T14:15:13Z,หยุดคิดถึงเรื่องเศร้าในอดีตไม่ได้ จำเรื่องที่แย่ได้ดีกว่า การจำเรื่องที่ดี,สมองของเราจัดการบริหารด้านความจำทั้งดีและร้ายแตกต่างกัน... คนเราจดจำเรื่องราวแย่ ๆ ได้ดีกว่าการจดจำเรื่องราวดี ๆ หรือเพราะจริง ๆ ...,https://i.ytimg.com/vi/9SyJUrXUtoI/default.jpg,https://i.ytimg.com/vi/9SyJUrXUtoI/mqdefault.jpg,https://i.ytimg.com/vi/9SyJUrXUtoI/hqdefault.jpg,none
J3v51hdCs4g,UCKIEPfI9D32EnsP6oasduSg,Alljit สุขภาพจิตใจ,2022-03-08T14:00:13Z,อ่อนไหวง่าย ร้องไห้ง่าย แต่ไม่ได้แปลว่า เป็นคนอ่อนแอ,ความอ่อนไหวง่ายไม่ได้เท่ากับความอ่อนแอ ...,https://i.ytimg.com/vi/J3v51hdCs4g/default.jpg,https://i.ytimg.com/vi/J3v51hdCs4g/mqdefault.jpg,https://i.ytimg.com/vi/J3v51hdCs4g/hqdefault.jpg,none
Qq-U2hGn1u0,UCKIEPfI9D32EnsP6oasduSg,Alljit สุขภาพจิตใจ,2022-03-06T14:00:31Z,จัดการความเครียดอย่างไร? เมื่อความเครียดที่มี มากเกินไป,ความเครียดเป็นสภาวะอารมณ์หนึ่งที่มันเกิดขึ้นในเเวลาที่ตัวเรากำลังเผชิญกับปัญหา ...,https://i.ytimg.com/vi/Qq-U2hGn1u0/default.jpg,https://i.ytimg.com/vi/Qq-U2hGn1u0/mqdefault.jpg,https://i.ytimg.com/vi/Qq-U2hGn1u0/hqdefault.jpg,none
lMJbwOaH43Y,UCKIEPfI9D32EnsP6oasduSg,Alljit สุขภาพจิตใจ,2022-03-04T12:51:43Z,เด็กห้ามเถียงผู้ใหญ่จริง? ต้องยอมเพราะ ผู้ใหญ่อาบน้ำร้อนมาก่อน? - ชีวิตในวัยรุ่น EP.12,ความรู้สึกอึดอัดใจและน้อยใจเพราะไม่สามารถแสดงความคิดเห็นอะไรกับครอบครัวได้เลย เพราะถูกมองว่าขี้เถียงและเป็นเด็กก้าวร้าว ...,https://i.ytimg.com/vi/lMJbwOaH43Y/default.jpg,https://i.ytimg.com/vi/lMJbwOaH43Y/mqdefault.jpg,https://i.ytimg.com/vi/lMJbwOaH43Y/hqdefault.jpg,none
E0ecYJUn5Go,UCKIEPfI9D32EnsP6oasduSg,Alljit สุขภาพจิตใจ,2022-03-02T15:52:56Z,เสพข่าวเศร้า อาจทำให้เครียด จนส่งผลต่อสุขภาพจิต รับมืออย่างไรดี?,เพราะโซเชียลมีเดียกลายเป็นส่วนหนึ่งของชีวิต เข้าแอพใดแอพหนึ่งไปแน่นอนว่าหน้าฟีดจะมีทั้งโพสต์ที่เป็นบทความ รูปภาพ วิดีโอ ...,https://i.ytimg.com/vi/E0ecYJUn5Go/default.jpg,https://i.ytimg.com/vi/E0ecYJUn5Go/mqdefault.jpg,https://i.ytimg.com/vi/E0ecYJUn5Go/hqdefault.jpg,none
r1oQWAWUwZM,UCKIEPfI9D32EnsP6oasduSg,Alljit สุขภาพจิตใจ,2022-02-24T13:46:13Z,เวลาผ่านไป 1 ปี เราได้เรียนรู้อะไร - Jane Story EP.4,เชื่อว่าทุกคนคงทราบกันดีว่า “ เวลาไม่เคยรอใคร ” และเราเองก็ไม่สามารถย้อนเวลากลับไปแก้ไขอดีตได้ ...,https://i.ytimg.com/vi/r1oQWAWUwZM/default.jpg,https://i.ytimg.com/vi/r1oQWAWUwZM/mqdefault.jpg,https://i.ytimg.com/vi/r1oQWAWUwZM/hqdefault.jpg,none
rOduswCrRt4,UCKIEPfI9D32EnsP6oasduSg,Alljit สุขภาพจิตใจ,2022-02-22T14:00:13Z,ลืมไปว่าทุกวัน.. อาจไม่ได้เจอเธอเหมือนเดิม - Jane Story EP.3,ลืมไปว่าทุกวัน อาจไม่ได้เจอเธอเหมือนเดิม ลืมไปว่าชีวิตมันดีแค่ไหน ที่ได้พบความรักดีๆ ของเธอ ...,https://i.ytimg.com/vi/rOduswCrRt4/default.jpg,https://i.ytimg.com/vi/rOduswCrRt4/mqdefault.jpg,https://i.ytimg.com/vi/rOduswCrRt4/hqdefault.jpg,none
U7_tGQ6oeMs,UCKIEPfI9D32EnsP6oasduSg,Alljit สุขภาพจิตใจ,2022-02-21T16:02:46Z,ระงับความโกรธ อย่างไร? โดยนักจิตวิทยา,รวมบทความ สุขภาพใจใน - https://www.alljitblog.com/ ฟัง Alljit Podcast ในช่องทางอื่นๆ Spotify ...,https://i.ytimg.com/vi/U7_tGQ6oeMs/default.jpg,https://i.ytimg.com/vi/U7_tGQ6oeMs/mqdefault.jpg,https://i.ytimg.com/vi/U7_tGQ6oeMs/hqdefault.jpg,none
kVYsxSjz8xI,UCKIEPfI9D32EnsP6oasduSg,Alljit สุขภาพจิตใจ,2022-02-20T13:39:45Z,การก้าวข้ามผ่านวันแย่ๆ ใจดีกับตัวเอง แม้วันนี้โลกจะแย่ใส่เรา,ไม่รู้จะเริ่มต้นใหม่กับวันพรุ่งนี้ยังไง.. ไม่รู้ว่าวันพรุ่งนี้มันจะยังแย่แบบนี้อยู่ไหม ? เป็นความรู้สึกที่เมื่อไหร่จะผ่านช่วงนี้ไปสักที ...,https://i.ytimg.com/vi/kVYsxSjz8xI/default.jpg,https://i.ytimg.com/vi/kVYsxSjz8xI/mqdefault.jpg,https://i.ytimg.com/vi/kVYsxSjz8xI/hqdefault.jpg,none
vdYj3njVWJk,UCKIEPfI9D32EnsP6oasduSg,Alljit สุขภาพจิตใจ,2022-02-18T15:25:41Z,เหนื่อย ท้อ อยากร้องไห้ จนใจไม่อยากอยู่ต่อ..,เราตัดพ้อชีวิตและคิดว่าไม่อยากมีชีวิตอยู่ต่อไป ไม่รู้ว่าเจ้าตัวปัญหาและความเหนื่อยล้าตรงนี้จะจบลงเมื่อไหร่ ...,https://i.ytimg.com/vi/vdYj3njVWJk/default.jpg,https://i.ytimg.com/vi/vdYj3njVWJk/mqdefault.jpg,https://i.ytimg.com/vi/vdYj3njVWJk/hqdefault.jpg,none
zTILVM7eRPA,UCKIEPfI9D32EnsP6oasduSg,Alljit สุขภาพจิตใจ,2022-02-16T08:26:23Z,ค้นหาตัวเองไม่เจอ ไม่รู้ว่าตัวเองชอบอะไร ถนัดอะไร - ชีวิตในวัยรุ่น EP.11,ถ้าพูดกันถึงเรื่อง อนาคตสำหรับวัยรุ่น เป็นเรื่องที่สำคัญมาก ๆ เราคงมีคำถามกับตัวเองมากมาย ว่าจะเรียนสายไหนดี จะทำงานอะไรดี ...,https://i.ytimg.com/vi/zTILVM7eRPA/default.jpg,https://i.ytimg.com/vi/zTILVM7eRPA/mqdefault.jpg,https://i.ytimg.com/vi/zTILVM7eRPA/hqdefault.jpg,none
KFLCmxTTPS8,UCKIEPfI9D32EnsP6oasduSg,Alljit สุขภาพจิตใจ,2022-02-15T16:37:34Z,ช่วงนี้ไม่มีความสุขเลย รู้สึกเฉยๆ กับสิ่งรอบๆ ตัว,ไม่มีความสุข ไม่อยากจะทำอะไร ไม่อยากจะใช้ชีวิต จนทำให้เกิดความรู้สึกไร้เป้าหมายในชีวิต การทำสิ่งต่างๆการทำงาน การเรียน ...,https://i.ytimg.com/vi/KFLCmxTTPS8/default.jpg,https://i.ytimg.com/vi/KFLCmxTTPS8/mqdefault.jpg,https://i.ytimg.com/vi/KFLCmxTTPS8/hqdefault.jpg,none
bXgnaWnF55U,UCKIEPfI9D32EnsP6oasduSg,Alljit สุขภาพจิตใจ,2022-02-13T14:15:12Z,พัฒนาวันละ 1% ก็ประสบความสำเร็จอันยิ่งใหญ่ Atomic habits - Mini Reader EP.10,ทำอย่างไรเมื่อพยายามเปลี่ยนแปลงตัวเองมาโดยตลอดแต่ไม่สำเร็จสักที? มาค้นหาคำตอบกับ หนังสือ “Atomic habits เพราะชีวิตดีได้กว่าที่เป็น” ...,https://i.ytimg.com/vi/bXgnaWnF55U/default.jpg,https://i.ytimg.com/vi/bXgnaWnF55U/mqdefault.jpg,https://i.ytimg.com/vi/bXgnaWnF55U/hqdefault.jpg,none
MSXd0maBHRw,UCKIEPfI9D32EnsP6oasduSg,Alljit สุขภาพจิตใจ,2022-02-12T14:15:15Z,เรื่องราวของความรู้สึกว่างเปล่า ไม่รู้ว่าคืออะไร ? แค่รู้สึกว่างเปล่าอยู่ภายในใจ,เวลาที่เราเกิดความรู้สึกว่างเปล่า ความรู้สึกว่าไม่รู้จะต้องรู้สึกอะไร หรือว่าไม่รู้ว่ามันคืออะไร ? แค่รู้ว่ามันว่างเปล่าอยู่ภายในกับตัวเราเอง ...,https://i.ytimg.com/vi/MSXd0maBHRw/default.jpg,https://i.ytimg.com/vi/MSXd0maBHRw/mqdefault.jpg,https://i.ytimg.com/vi/MSXd0maBHRw/hqdefault.jpg,none
gz2ZZ3kMp-w,UCKIEPfI9D32EnsP6oasduSg,Alljit สุขภาพจิตใจ,2022-02-09T09:03:11Z,ความสุขคืออะไร? ทำไมเมื่อเรายิ่งตามหา &#39;ยิ่งไม่เจอ&#39;,เคยตั้งคำถามไหมว่าความสุขคืออะไร ? แล้วทำไมเรายิ่งตามหายิ่งไม่เจอ ถ้าพูดถึงนิยามของความสุขแต่ละคนก็คงให้นิยามที่แตกต่างกันออกไป ...,https://i.ytimg.com/vi/gz2ZZ3kMp-w/default.jpg,https://i.ytimg.com/vi/gz2ZZ3kMp-w/mqdefault.jpg,https://i.ytimg.com/vi/gz2ZZ3kMp-w/hqdefault.jpg,none
bBRrX_3RHk0,UCKIEPfI9D32EnsP6oasduSg,Alljit สุขภาพจิตใจ,2022-02-07T12:52:06Z,ยิ่งเห็นคนอื่น ประสบความสำเร็จ ยิ่งรู้สึกว่าตัวเองไม่เอาไหน,เวลาที่เราเห็นชีวิตคนอื่นเขามีความสุข ไม่ว่าจะใครๆก็ดูประสบความสำเร็จแต่ในขณะเดียวกันเรายังคงอยู่ในจุดเดิม ...,https://i.ytimg.com/vi/bBRrX_3RHk0/default.jpg,https://i.ytimg.com/vi/bBRrX_3RHk0/mqdefault.jpg,https://i.ytimg.com/vi/bBRrX_3RHk0/hqdefault.jpg,none
aqt0xoVqPmY,UCKIEPfI9D32EnsP6oasduSg,Alljit สุขภาพจิตใจ,2022-02-03T10:55:53Z,อยู่ที่ไหน ก็ไม่มีความสุข.. เหมือนกับว่า อยู่ที่ไหน ก็ไม่ใช่ที่ของเรา,เวลาที่เราอยู่ตรงไหนแล้วเรารูัสึกว่ามันไม่ใช่ที่ของเรา เพราะอะไรกันทำไมเราถึงรู้สึกว่าที่ตรงนี้ไม่เหมาะกับเราเลย ?,https://i.ytimg.com/vi/aqt0xoVqPmY/default.jpg,https://i.ytimg.com/vi/aqt0xoVqPmY/mqdefault.jpg,https://i.ytimg.com/vi/aqt0xoVqPmY/hqdefault.jpg,none
8WqFh9wjfe8,UCKIEPfI9D32EnsP6oasduSg,Alljit สุขภาพจิตใจ,2022-01-31T14:34:53Z,รู้สึกแย่กับตัวเอง รู้สึกว่า เกิดมาพร้อมกับคำว่า &#39;ขี้แพ้&#39;,เชื่อว่าเราทุกคนคงจะมีวันที่รู้สึกแย่กับตัวเอง จะมองไปทางไหนก็เหมือนจะไร้หนทางไปหมดจนเกิดคำถามกับตัวเองว่า ทำไมชีวิตเรามันดูแย่จังเลย ?,https://i.ytimg.com/vi/8WqFh9wjfe8/default.jpg,https://i.ytimg.com/vi/8WqFh9wjfe8/mqdefault.jpg,https://i.ytimg.com/vi/8WqFh9wjfe8/hqdefault.jpg,none
X2ehCma7gEo,UCKIEPfI9D32EnsP6oasduSg,Alljit สุขภาพจิตใจ,2022-01-31T05:21:39Z,ความกดดันจาก &#39;ความคาดหวังจากครอบครัว&#39;,รวมบทความ สุขภาพใจใน - https://www.alljitblog.com/ ฟัง Alljit Podcast ในช่องทางอื่นๆ Spotify ...,https://i.ytimg.com/vi/X2ehCma7gEo/default.jpg,https://i.ytimg.com/vi/X2ehCma7gEo/mqdefault.jpg,https://i.ytimg.com/vi/X2ehCma7gEo/hqdefault.jpg,none
HRy46YhQ4iE,UCKIEPfI9D32EnsP6oasduSg,Alljit สุขภาพจิตใจ,2022-01-28T16:08:49Z,รวม Podcast สำหรับคนคิดมาก และคิดลบต่อตัวเอง โดยนักจิตวิทยาคลินิก - Long Play,รวม Podcast สำหรับคนคิดมาก และคิดลบต่อตัวเอง โดยนักจิตวิทยาคลินิก - Long Play 00:00 | เริ่มต้น 00:10 | เมื่อไหร่จะเลิกแคร์คนอื่นสักที ...,https://i.ytimg.com/vi/HRy46YhQ4iE/default.jpg,https://i.ytimg.com/vi/HRy46YhQ4iE/mqdefault.jpg,https://i.ytimg.com/vi/HRy46YhQ4iE/hqdefault.jpg,none
qpT2H5Pi3lQ,UCKIEPfI9D32EnsP6oasduSg,Alljit สุขภาพจิตใจ,2022-01-26T14:03:20Z,รวม Podcast วิธีสร้างความสุข การรับมือ เมื่อรู้สึกไม่มีความสุขเลย  - Long Play,รวม Podcast วิธีสร้างความสุข การรับมือ เมื่อรู้สึกไม่มีความสุขเลย - Long Play 00:00 | เริ่มต้น 00:10 | เราจะให้อภัย ...,https://i.ytimg.com/vi/qpT2H5Pi3lQ/default.jpg,https://i.ytimg.com/vi/qpT2H5Pi3lQ/mqdefault.jpg,https://i.ytimg.com/vi/qpT2H5Pi3lQ/hqdefault.jpg,none
9-nJ7x7tbBE,UCKIEPfI9D32EnsP6oasduSg,Alljit สุขภาพจิตใจ,2022-01-25T15:58:35Z,ศัตรูที่ร้ายที่สุดของเรา อาจเป็นตัวเราเอง - Mini Reader EP.8,Ego” หรือ “อัตตา” คือสิ่งที่ผลักดันให้เราทำตามเป้าหมายได้สำเร็จ แต่บางครั้งก็อาจจะเป็นสิ่งที่ทำให้เราไปไม่ถึงเป้าหมายที่วางไว้ ...,https://i.ytimg.com/vi/9-nJ7x7tbBE/default.jpg,https://i.ytimg.com/vi/9-nJ7x7tbBE/mqdefault.jpg,https://i.ytimg.com/vi/9-nJ7x7tbBE/hqdefault.jpg,none
tFTdHUtgywg,UCKIEPfI9D32EnsP6oasduSg,Alljit สุขภาพจิตใจ,2022-01-23T12:59:30Z,สำรวจตัวเอง ว่าเป็นคนกลัวการล้มเหลวหรือไม่,รวมบทความ สุขภาพใจใน - https://www.alljitblog.com/ ฟัง Alljit Podcast ในช่องทางอื่นๆ Spotify ...,https://i.ytimg.com/vi/tFTdHUtgywg/default.jpg,https://i.ytimg.com/vi/tFTdHUtgywg/mqdefault.jpg,https://i.ytimg.com/vi/tFTdHUtgywg/hqdefault.jpg,none
nuceVqD03rI,UCKIEPfI9D32EnsP6oasduSg,Alljit สุขภาพจิตใจ,2022-01-21T15:34:03Z,รู้สึกหมดไฟในการเรียน รู้สึกหมดแรง เหนื่อย เครียดกับอนาคต - ชีวิตในวัยรุ่น EP.8,ตอนเด็ก ๆ เวลาที่เราอยากไปโรงรียน ไม่ใช่เพราะอยากไปเรียนอย่างเดียว แต่อาจจะอยากไปเจอเพื่อน อยากเจอกับบรรยากาศในโรงเรียน ...,https://i.ytimg.com/vi/nuceVqD03rI/default.jpg,https://i.ytimg.com/vi/nuceVqD03rI/mqdefault.jpg,https://i.ytimg.com/vi/nuceVqD03rI/hqdefault.jpg,none
a8PuVjoNRu8,UCKIEPfI9D32EnsP6oasduSg,Alljit สุขภาพจิตใจ,2022-01-19T14:49:53Z,ชีวิตที่ดี เริ่มต้นที่เป้าหมายที่ชัดเจน - Mini Reader EP.7,ชีวิตที่ดี เริ่มต้นที่เป้าหมายที่ชัดเจน ทำไมบางคนจึงบรรลุเป้าหมายทุกอย่างในชีวิตของพวกเขาได้ ในขณะที่คนอื่นได้แต่ฝันว่าจะมีชีวิตที่ดีขึ้น?,https://i.ytimg.com/vi/a8PuVjoNRu8/default.jpg,https://i.ytimg.com/vi/a8PuVjoNRu8/mqdefault.jpg,https://i.ytimg.com/vi/a8PuVjoNRu8/hqdefault.jpg,none
zhfOVdjBm3U,UCKIEPfI9D32EnsP6oasduSg,Alljit สุขภาพจิตใจ,2022-01-16T11:05:18Z,สมาธิสั้น ทำอย่างไรดี,รวมบทความ สุขภาพใจใน - https://www.alljitblog.com/ ฟัง Alljit Podcast ในช่องทางอื่นๆ Spotify ...,https://i.ytimg.com/vi/zhfOVdjBm3U/default.jpg,https://i.ytimg.com/vi/zhfOVdjBm3U/mqdefault.jpg,https://i.ytimg.com/vi/zhfOVdjBm3U/hqdefault.jpg,none
sXqU8xedno8,UCKIEPfI9D32EnsP6oasduSg,Alljit สุขภาพจิตใจ,2022-01-15T13:45:08Z,เราไม่สามารถให้เวลา กับทุกสิ่งที่เข้ามาในชีวิตได้ - Mini Reader EP.6,คนเราทุกคนมีเวลาเท่ากัน แต่เคยสงสัยไหมว่าทำไมบางคนดูยุ่งและเครียดตลอดเวลา บางคนก็สามารถทำทุกอย่างได้สบายๆ ...,https://i.ytimg.com/vi/sXqU8xedno8/default.jpg,https://i.ytimg.com/vi/sXqU8xedno8/mqdefault.jpg,https://i.ytimg.com/vi/sXqU8xedno8/hqdefault.jpg,none
NRR9rjmQk8Q,UCKIEPfI9D32EnsP6oasduSg,Alljit สุขภาพจิตใจ,2022-01-13T12:57:17Z,รวม Podcast บ้านไม่ใช่ Safe Zone รู้สึกไม่อบอุ่น เมื่ออยู่บ้าน - Long Play,รวม Podcast บ้านไม่ใช่ Safe Zone รู้สึกไม่อบอุ่น เมื่ออยู่บ้าน 00:00 | เริ่ม 00:10 | ครอบครัว คือ คนที่บั่นทอนจิตใจ 12:13 | ครอบครัว ชอบตีกรอบ ...,https://i.ytimg.com/vi/NRR9rjmQk8Q/default.jpg,https://i.ytimg.com/vi/NRR9rjmQk8Q/mqdefault.jpg,https://i.ytimg.com/vi/NRR9rjmQk8Q/hqdefault.jpg,none
yJKNiNWm3i0,UCKIEPfI9D32EnsP6oasduSg,Alljit สุขภาพจิตใจ,2022-01-12T13:00:14Z,เพราะอะไร มนุษย์ถึงสามารถครองโลกได้ - Mini Reader EP.5,เคยสงสัยไหมว่ามนุษย์เป็นมาจนถึงทุกวันนี้ได้อย่างไร ทำไมเราอยู่บนโลกได้นานขนาดนี้ ...,https://i.ytimg.com/vi/yJKNiNWm3i0/default.jpg,https://i.ytimg.com/vi/yJKNiNWm3i0/mqdefault.jpg,https://i.ytimg.com/vi/yJKNiNWm3i0/hqdefault.jpg,none
Jk4DUIg34Qc,UCKIEPfI9D32EnsP6oasduSg,Alljit สุขภาพจิตใจ,2022-01-11T13:13:42Z,รวม Podcast โรคซึมเศร้า ในโลกซึมเศร้าใบนั้น ภายในเป็นอย่างไร - Long Play,รวม Podcast โรคซึมเศร้า ในโลกซึมเศร้าใบนั้น ภายในเป็นอย่างไร - Long Play 00:00 | เริ่ม 00:10 | ผู้ป่วย 'โรคซึมเศร้า' ในใจเป็นอย่างไร 35:44 ...,https://i.ytimg.com/vi/Jk4DUIg34Qc/default.jpg,https://i.ytimg.com/vi/Jk4DUIg34Qc/mqdefault.jpg,https://i.ytimg.com/vi/Jk4DUIg34Qc/hqdefault.jpg,none
